{"newsletter":{"date":"2025-12-18","period":"2025-12-11 to 2025-12-18","agenda":[{"date":"2025-12-17","event":"David Byrne Radio Presents: Christmas Music for People Who Hate Christmas Music","description":"A playlist of rowdy, fun songs that gently poke at and refer to the holidays. Enjoy!","link":"https://www.davidbyrne.com/radio/david-byrne-radio-presents-christmas"},{"date":"2026-03-06","event":"Ora Sono Un Lago by Bono / Burattini","description":"A new album by Bono / Burattini, featuring dense and unforgiving songs with richly assembled textures and echoed out other-worldly choirs.","link":""},{"date":"2025-12-16","event":"Dubcore Volume 26 by Gabber Dub Project","description":"A new release from Gabber Dub Project, featuring tracks like Besaet, Dubsaet, and This Is Gabber Dub.","link":""},{"date":"2026-03-03","event":"Pétale Défoule by La Bande à Bader","description":"A new album from La Bande à Bader, featuring a mix of heavy breakbeat bass, stepper accents, and dnb influences.","link":""}],"members":[{"name":"mbertier@parishq.net","contributions":[{"title":"Pétale Défoule by La Bande à Bader","description":"Pétale Défoule is an album that opens with an intriguing 'Intro' and features tracks like 'Barbarie' and 'Slurpdub'. The album is a mix of heavy breaked bass, stepper accents, and dnb influences. Larsen's work is described as epic and percussive, blending with smooth melodies and virtuoso synths.","link":"https://www.musiques-incongrues.net/d/15351-petale-defoule-by-la-bande-a-bader/1"},{"title":"An Irish Almanac of Noise and Experimental Music From 2025 by Nyahh Records","description":"Nyahh Records presents a collection of contemporary noise and experimental musicians from across the island of Ireland. This compilation includes 32 tracks covering noise, acoustic, electroacoustic, electronics, Musique Concrete, tape music, and drone.","link":"https://www.musiques-incongrues.net/d/15355-an-irish-almanac-of-noise-and-experimental-music-from-2025-by-nyahh-records/1"}]},{"name":"rottweiller.slip@gmail.com","contributions":[{"title":"Ora Sono Un Lago by Bono / Burattini","description":"The new album by Bono / Burattini, 'Ora Sono Un Lago,' is a tenacious and brooding collection of work that testifies to the duo's growth and ghostly ability to immerse kosmische landscapes, stripped electronica, and oscillatory psychedelia.","link":"https://www.musiques-incongrues.net/d/15356-ora-sono-un-lago-by-bono-burattini/1"},{"title":"Dubcore Volume 26 by Gabber Dub Project","description":"A new release from Gabber Dub Project, featuring tracks like Besaet, Dubsaet, and This Is Gabber Dub. The album includes a mix of heavy dub and gabber influences.","link":"https://www.musiques-incongrues.net/d/15353-dubcore-volume-26-by-gabber-dub-project/1"}]},{"name":"nota2k@gmail.com","contributions":[{"title":"Pétale Défoule by La Bande à Bader","description":"Pétale Défoule is an album that opens with an intriguing 'Intro' and features tracks like 'Barbarie' and 'Slurpdub'. The album is a mix of heavy breaked bass, stepper accents, and dnb influences. Larsen's work is described as epic and percussive, blending with smooth melodies and virtuoso synths.","link":"https://www.musiques-incongrues.net/d/15351-petale-defoule-by-la-bande-a-bader/1"},{"title":"An Irish Almanac of Noise and Experimental Music From 2025 by Nyahh Records","description":"Nyahh Records presents a collection of contemporary noise and experimental musicians from across the island of Ireland. This compilation includes 32 tracks covering noise, acoustic, electroacoustic, electronics, Musique Concrete, tape music, and drone.","link":"https://www.musiques-incongrues.net/d/15355-an-irish-almanac-of-noise-and-experimental-music-from-2025-by-nyahh-records/1"}]}],"gallery":[{"type":"image","url":"https://f4.bcbits.com/img/a3736346285_16.jpg","description":"Cover of Pétale Défoule by La Bande à Bader"},{"type":"image","url":"https://f4.bcbits.com/img/a1785496700_16.jpg","description":"Cover of Ora Sono Un Lago by Bono / Burattini"},{"type":"video","url":"https://www.youtube.com/watch?v=ibbSzr6_HIw","description":"Crank Sturgeon live performance"}],"markdown":"# Newsletter Hebdomadaire - 2025-12-18\n\n## Agenda\n\n- **2025-12-17**: [David Byrne Radio Presents: Christmas Music for People Who Hate Christmas Music](https://www.davidbyrne.com/radio/david-byrne-radio-presents-christmas)\n  A playlist of rowdy, fun songs that gently poke at and refer to the holidays. Enjoy!\n\n- **2026-03-06**: Ora Sono Un Lago by Bono / Burattini\n  A new album by Bono / Burattini, featuring dense and unforgiving songs with richly assembled textures and echoed out other-worldly choirs.\n\n- **2025-12-16**: Dubcore Volume 26 by Gabber Dub Project\n  A new release from Gabber Dub Project, featuring tracks like Besaet, Dubsaet, and This Is Gabber Dub.\n\n- **2026-03-03**: Pétale Défoule by La Bande à Bader\n  A new album from La Bande à Bader, featuring a mix of heavy breakbeat bass, stepper accents, and dnb influences.\n\n\n## Contributions des Membres\n\n### mbertier@parishq.net\n\n- **[Pétale Défoule by La Bande à Bader](https://www.musiques-incongrues.net/d/15351-petale-defoule-by-la-bande-a-bader/1)**\n  Pétale Défoule is an album that opens with an intriguing 'Intro' and features tracks like 'Barbarie' and 'Slurpdub'. The album is a mix of heavy breaked bass, stepper accents, and dnb influences. Larsen's work is described as epic and percussive, blending with smooth melodies and virtuoso synths.\n\n- **[An Irish Almanac of Noise and Experimental Music From 2025 by Nyahh Records](https://www.musiques-incongrues.net/d/15355-an-irish-almanac-of-noise-and-experimental-music-from-2025-by-nyahh-records/1)**\n  Nyahh Records presents a collection of contemporary noise and experimental musicians from across the island of Ireland. This compilation includes 32 tracks covering noise, acoustic, electroacoustic, electronics, Musique Concrete, tape music, and drone.\n\n### rottweiller.slip@gmail.com\n\n- **[Ora Sono Un Lago by Bono / Burattini](https://www.musiques-incongrues.net/d/15356-ora-sono-un-lago-by-bono-burattini/1)**\n  The new album by Bono / Burattini, 'Ora Sono Un Lago,' is a tenacious and brooding collection of work that testifies to the duo's growth and ghostly ability to immerse kosmische landscapes, stripped electronica, and oscillatory psychedelia.\n\n- **[Dubcore Volume 26 by Gabber Dub Project](https://www.musiques-incongrues.net/d/15353-dubcore-volume-26-by-gabber-dub-project/1)**\n  A new release from Gabber Dub Project, featuring tracks like Besaet, Dubsaet, and This Is Gabber Dub. The album includes a mix of heavy dub and gabber influences.\n\n### nota2k@gmail.com\n\n- **[Pétale Défoule by La Bande à Bader](https://www.musiques-incongrues.net/d/15351-petale-defoule-by-la-bande-a-bader/1)**\n  Pétale Défoule is an album that opens with an intriguing 'Intro' and features tracks like 'Barbarie' and 'Slurpdub'. The album is a mix of heavy breaked bass, stepper accents, and dnb influences. Larsen's work is described as epic and percussive, blending with smooth melodies and virtuoso synths.\n\n- **[An Irish Almanac of Noise and Experimental Music From 2025 by Nyahh Records](https://www.musiques-incongrues.net/d/15355-an-irish-almanac-of-noise-and-experimental-music-from-2025-by-nyahh-records/1)**\n  Nyahh Records presents a collection of contemporary noise and experimental musicians from across the island of Ireland. This compilation includes 32 tracks covering noise, acoustic, electroacoustic, electronics, Musique Concrete, tape music, and drone.\n\n\n## Galerie\n\n- ![Cover of Pétale Défoule by La Bande à Bader](https://f4.bcbits.com/img/a3736346285_16.jpg)\n\n- ![Cover of Ora Sono Un Lago by Bono / Burattini](https://f4.bcbits.com/img/a1785496700_16.jpg)\n\n- [Crank Sturgeon live performance](https://www.youtube.com/watch?v=ibbSzr6_HIw)"}}